{
  "version": "v1",
  "kind": "verification",
  "category": "hybrid-long-plaintext",
  "description": "Hybrid roundtrip with a 2048-byte plaintext under an RSA-2048 recipient. Verifies that the RSA-OAEP-AES256GCM-SHA256 suite lifts the n-66 ceiling of Section 8.4. The same plaintext under RSA-OAEP-SHA256 would have been rejected at producer step 4 (Section 10.1) with plaintext-too-large.",
  "spec_references": [
    "spec/v1/08-crypto-suites.md#8.10",
    "spec/v1/06-message-body.md#6.5",
    "spec/v1/10-encrypt-decrypt.md#10.3.1"
  ],
  "cases": [
    {
      "id": "v1-ver-hybrid-long-plaintext-001",
      "description": "2048-byte plaintext to a 2048-bit recipient under the hybrid suite.",
      "inputs": {
        "wire": "PLAINCLOAK:v1:BR:ALO0eLeLzGDzmNvyv1tLaejc9kNDI99TZaCWujckx8yYvLlIBNEv5lzeXpxfsPvqNoF6SZWtmxxXyAoHMcMbX11zkNr1xt4BY89JTSs77FzMh3Or14GfqWvaT6fM9eV2mIz3DFjC0xASRHq6Hj9W2TeeJIh3U5PPSEjvYjUqXmlF4DW1qNqmmOSd4ROhmNeUaZHbneSvFlTjd9MaXeast6tD2hvsUdawKE8A9YPWTUMCmw1iLUJoFwn6ijKYwy68Xxd7hc3d0BLE9bH1oI8XnfWg5qKssZ0PHmmtVc6YehymrrvJcZiJ8goMdfcpxPUA0M4phdSZW2O29Bx1d14LWUVUVwFXag2l9S0OOZHYIFvdozi9fvyUztwqonMnUYBIHjdlqFTksPWapEW3BJeQ3YLLa6uHj9xFN1LHUG0T1Ln1k5Toznx89hcSqCjtkAHNQNmQnLNqaeF6NZE75USFpbgCncUAIOUPrrJJRU9BT99JSPUUDBBuMeZROKEqofej0t0TYVTwlDuzhOsJCFsbiWZCCxbRp45NQTRcs6cS7BIWz1gVSfoZrskwtx7mMWTs25EzKTKZ0kSXqAnVGngOT1Ip8X4aNPJzlTUOulv18vqqEgVug9Gu3A37WVEfVWWTcWuqmIs0nmsheliZEIZh7KuuXEmllZhOMh3SWqGQo70UGA0FfWiKYUFgonCitHQgR4Ra2836kUVwc4Yaww66HprWPdnrlzNJ7T7DxWqaIuUXaUBHfUMsvgCENlGCyUDXj305uYNQO9I8ClaXm9IkSnRmE3z3CSwbo9ruYcxHmslAimUsl3lFO1H371UOXfymueAv39M81LrFRYakEmKiYo2cDV1Dewx4ptXuvCDRnZqVlnu0T8ZCfppJYZd4Fi7UErNLP5fuV6qrZbqKo5nz8hsIwjCRT58g1cDciTxaGdQMZCJ9PA3t0gF5bzi3sCmMFuWgTAmVlPFSm3Lb8X8hbTvaGcSuEmr4JdFfXljVFT8kJg323ohraZqdWistUommL8gaA0dvjycVHsmRZw59XXlqDLYGe2l2kKNDU37CGqIxrt88GAaenxbQiVp9J8etCZtsftP6k5AA6aGNNbODziv6BHGEoSSlM1CxzT7OjtR7iAYRjYotBpcQNFtqgBa1KecdmbZQMPyUNHAVukT7f6Gv4EcAxlEiKZxSv7kNDPUj8u46QORWq4emGPIMT1LGMMBmRkfM8ocV92XaTq2LgOE9IGdrItk6aRfDXpgBfmFfelEyk3oDbRrQVRqGs5QpibrJzOJGzWUEmqWL2ohFdCaDiOVGjo2hqSyK1pRveOdHwQoFRggPEYDeRQbfMFZ4M2UbkTiJqzlymIF6EHNeXQCiVkDpJnNVSzCBprffa4OXA3hpi2ATozcNU3bYM17f2HZLU3FU8LNfOgRumluckuPVWsXdzhcur50MNzDKOCYh8cc9LHrxcBkNZTpVzVXSMZSVfsfnIjtVVxr3Uhgs8gnjnLsriQUVu8J8kLRDXVQLO9vWaqUScLf1on1oQXjreYyhlLNlIfXt5oNV9HJzAKBB771C9sUY7600WNclD4fYhs6dSYgZUYB23NpEpz00beAhysWwyoHT3BXV4kEYPDQ9boITIk48mnWJyzvdVvegVjKkRi1YQJktsiHY3ZyCp8iUea67wgfROhNAO7jVyLY1U4mP8iEJWtyXC4hnFtHWavNRUlKwagw3FuhA3W2Qo9LA8VRI35vFzTGUYNu8yrPIzwIfKzgA7zumf7LT2VYW6gzkuJrwCNSPapqSHufkUTRttWng1x7E1DxntksjRXMYuGlwwHaQ3KhduVCwY75E9FcItNWpv9leyKnWYGIRdNzXkJtpRvjaZwFFJXcneMrwxflzPRaQNsU4IzSvx7hgwtlKjxsrxzdYJ6tXiXth7YLzIMZpINkbjJehO4775H0P4QrplkgA60wlVTt3FkxygfOkj51mJwtADTvnUzixrLKcq2atayUr6DHtE01N5UmmWLqXvxAnlkibKJolU3f2hsKp7rUrC4BibxJu9YGTlm2b8u6NX0P4Lv9rCmbwYX2agcqfCI5l46CfMBfogk62N08sv3Ke2ZeNheaOHcHKZiau9AUk5Pieg9pHUwF8mzcf6rwkLbWxJxey9cdqK3nG79En5Su1w7MAFCH6jNMAGKMfeNZZplksMMIZjIwmsRUhVnHPDvzA01RV7XavwgU4rnxpu6zgYtsdsPs1TvE6YPYaan8y22Z32lUz8xRycEE3rOfIH0QOsEuPzJEel3W2kjP77MixMjX9KxUAjrGpB9soTPPCmr2kJmPMyyj6h2OdC4RQRWQYjYniQw31nKeoHEtsXmdHrNWak34Ee5B8HuaGkYhSSUfo5rumY0WVuOZoOCa9gp1WhoGTRPs5UGNnjviqeML8ymrPs4jaUNhtybppJYmWvvGiJVv46y8YggYG3K7Xe7XAOZsHeq95zQOB8j6AGxgAHe4Re8kYyRxi30VANz6SAMTvDm1wFaRQxzD11dPUaGJxvSC2ALhVmhDp4ZM6wTvlQvosZN1yDgjZU2XqGeKejkXm1rQZTXRfMS1E6llRlBz74pe7H81lFs9M8OF6RT4BNV5BneCHKZt0uJJLKojGcef3c9IHCECoHqcuHNFcp8J1peZ1OZCGKZjovn0gKMhhJTjwmMTx2Q683jRRqKMyrOy6alWecz8Kxj6nVIzxjZ2xqC9RHhYL710fZPKRc79tMWZa9Yw6wJuWYO55FiQnlsN4bMMu6D7pj4hH3ynfnc6lyHhT0u3IZvnvwceoD1vUTU6dhe4WlDz5UWoG7GzZRnldaxexpqLODLqrc2Q0OsS2JX0RheW75VjcIjQxqrPrpoQ1mlZR2eH9eb53cKTjwQtUr8e90rgRUnN1XurH9BvO7jdKCxW3IYBZ846GSbrq63LhwhNGNW8KdKY7fy9r3SjWg2iBZHgCmv9ogJNHLYncvyMoWWC1wUm3iu2JV6pUQcZ8rMVyPgH61ZrSTFX89BdQfYZs1dEsfrGWRx0Z3wQLbG435ijkh4DGbF05VL8qG5lgAnut2Ey3GTJ9tB51v48BRLXeX2gc4zxULqNU3lCpFXmOsknxF6wYCsoraVB2vjPLz8I40UYg3719jM59cIGNlx0Wvoufko8DEsrfFf6e2WWC7jy7aCBBJVbMvlkdxiqUQKnlOjBbIqfOGU2TInephrm9jVuuNmdad3wobzVEjQxYLcZ8g7ukEFCSZ47otzSS40g25CfE6XBRefUI5Q1F9UBEapa0UDAURNcswgOp7YOw5qfsdJjc7wCbPexWGaUVt4SmU59zcNMbccRenPleUsNd2nAzncxcL0szx33yTU6hzoKBCLvBEJiVCf4JUxGXZW4FBnqrbZ7L9wMRK6xs3wzjxqVQBsydb9gNuk6dIG1QHxd9UV8j6dl6JkrlPsylppps2MNLwNSe7qmtreRl5OSsAzpz4VMs9DTet7tXwlVFXnsXidk7t5rCLxQjTQwT1sMtRPZ1Ln8J3UzLilwEN3z4DnBQIxozqbeBWEBNgLsiiGP65yg2Jom3wTQcYEZqdDKD2LNOO4Zn4jrAoObX7Pi4VyvgYhUgwpaiJMxuBi28MXnc9nuxzPQRqM50em39AD3RBUOE8a4BlByIkMojhsZQJFYPHoBhyJ0Y0rHzwuL1idTYc1BkEaMpRZOqcA8iykmGzZHx16TWjk2VxWZkJsBdcDishD0jv2fZ18A1V5pIhnRALrsQ5p4iaPwXYI1ZCa7CKtTmMAQvJv8KWwCH91pKYAP1sPfj8xLQ6PJJEtF8cljtX0BBKZEltD1zP5rHZqcoGechgnFGFCctDOpPucCwdXhANJdJjBvaVOHFt480fYB9oIdF6Nd6pn8eoYqife8USJWiVWeLtqGq16K4VuefWUa9MM3Uecpk33lfC8Ob6kMCLLBgoD3qCoHF9iDEA3iMwuaM6kUcDy5HErQOxl88GiTWh1yNYVuONm62yPxYbzxJr2R3nXLQGp22H3DkX8mAjOGRbeMUGmehdNqkVy5jTvDn94qHqqzttNh32V3d4C6BdJ8j5oDSoTkdUGjDdVWO6W2VcbmR3x8w8aVGTisznPJaHz",
        "recipient_priv_pem_path": "test-vectors/v1/fixtures/keys/alice-rsa2048-priv.pem",
        "trusted_senders": [
          {
            "key_hash": "b3cef20ec636c4125ae580da93dc0f13bdcdb1c3eea907543ed35ad52e024aee",
            "public_key_pem_path": "test-vectors/v1/fixtures/keys/bob-rsa4096-pub.pem"
          }
        ]
      },
      "expected": {
        "outcome": "verified",
        "plaintext": "This plaintext exceeds the RSA-OAEP-SHA256 ceiling under RSA-2048 (190 bytes) and even under RSA-4096 (446 bytes). This plaintext exceeds the RSA-OAEP-SHA256 ceiling under RSA-2048 (190 bytes) and even under RSA-4096 (446 bytes). This plaintext exceeds the RSA-OAEP-SHA256 ceiling under RSA-2048 (190 bytes) and even under RSA-4096 (446 bytes). This plaintext exceeds the RSA-OAEP-SHA256 ceiling under RSA-2048 (190 bytes) and even under RSA-4096 (446 bytes). This plaintext exceeds the RSA-OAEP-SHA256 ceiling under RSA-2048 (190 bytes) and even under RSA-4096 (446 bytes). This plaintext exceeds the RSA-OAEP-SHA256 ceiling under RSA-2048 (190 bytes) and even under RSA-4096 (446 bytes). This plaintext exceeds the RSA-OAEP-SHA256 ceiling under RSA-2048 (190 bytes) and even under RSA-4096 (446 bytes). This plaintext exceeds the RSA-OAEP-SHA256 ceiling under RSA-2048 (190 bytes) and even under RSA-4096 (446 bytes). This plaintext exceeds the RSA-OAEP-SHA256 ceiling under RSA-2048 (190 bytes) and even under RSA-4096 (446 bytes). This plaintext exceeds the RSA-OAEP-SHA256 ceiling under RSA-2048 (190 bytes) and even under RSA-4096 (446 bytes). This plaintext exceeds the RSA-OAEP-SHA256 ceiling under RSA-2048 (190 bytes) and even under RSA-4096 (446 bytes). This plaintext exceeds the RSA-OAEP-SHA256 ceiling under RSA-2048 (190 bytes) and even under RSA-4096 (446 bytes). This plaintext exceeds the RSA-OAEP-SHA256 ceiling under RSA-2048 (190 bytes) and even under RSA-4096 (446 bytes). This plaintext exceeds the RSA-OAEP-SHA256 ceiling under RSA-2048 (190 bytes) and even under RSA-4096 (446 bytes). This plaintext exceeds the RSA-OAEP-SHA256 ceiling under RSA-2048 (190 bytes) and even under RSA-4096 (446 bytes). This plaintext exceeds the RSA-OAEP-SHA256 ceiling under RSA-2048 (190 bytes) and even under RSA-4096 (446 bytes). This plaintext exceeds the RSA-OAEP-SHA256 ceiling under RSA-2048 (190 bytes) and even under RSA-4096 (446 bytes). This plaintext exceeds the RSA-OAEP-SHA256 ceiling under RSA-2048 (190 bytes) and even under ",
        "msg_id": "c1de17a9-2f06-474c-a4bd-eba3fa980900",
        "timestamp": 1746789123456,
        "sender_key_hash": "b3cef20ec636c4125ae580da93dc0f13bdcdb1c3eea907543ed35ad52e024aee",
        "recipient_key_hash": "1bf44bedd390cd114d5511c53286330f29c9fe70a4ab86118731860898ef88da"
      }
    }
  ]
}
