{
  "version": "v1",
  "kind": "verification",
  "category": "hybrid-tampered-wrap",
  "description": "A hybrid wire message with one byte of `wrapped_K` flipped after signing. RSA-OAEP decryption of the wrap MUST fail before signature verification is attempted (Section 10.2 step 2).",
  "spec_references": [
    "spec/v1/08-crypto-suites.md#8.10.5",
    "spec/v1/10-encrypt-decrypt.md#10.3.3"
  ],
  "cases": [
    {
      "id": "v1-ver-hybrid-tampered-wrap-001",
      "description": "Last byte of wrapped_K (offset M-1) flipped after signing.",
      "inputs": {
        "wire": "PLAINCLOAK:v1:BR:3kFpQXjKmimIkRr95OPkuyYVxS08k0BRGvbAnSzHqByrQaBUjaSP1phO4FXkS8KI5GMmlkq2Ec9Ag6h8vDg5s1DgnaBMIAV5xpxs3bDegBRUEAXT69VvKQ9rX9wjv4OZxtofRgwREHvuGWnvFnKKLnFNmyauoaAw77ABfh4r0wA9taZ3lIAqdJ4MD3tE1dD8K7OsVCYU53IrKRHt9qLQvnro0FFt8lZPwVhm8hoZH7nFOMkvNEVW25lU14WYTtZiFdsTjmsaQmovzU4oTM9sZpgR367eUF1MegTRODRtrnZ8ohss4PIhB25wZMXCfQUeJLUA4k0bVkx2GVjCScpL7So3lpln6b5zqLfph5CP25hoHltXkUAZTBJXI87v3D3zkK62R9dxGvZWN03PC70Jsc6Kuj7aqeehdDHTMpJ63QDK2MTW8wlmCKoiQtcVbDgcyx4SNfk50BVSzDUGQxms3Rxr2M53endlJQQr3Wlh8Bq3tTxFLc3T1Jj1J3SkyPEavK7g1uP2xdw2Gw5RPKCEHZvLqVRXbtqHY9nhG30e5RZ4Q0vj9R6fADftAV5DDCylo2Cmh0hVqm0to2WdtekXzOxTdp7NKhTVSvS9VLRTGiLa8pJzsCQKdwlkBMUjwa51DufM4CRZEgWv6TcExagyJBlJPiMdv93ZgFX3FUpeGf31696LRZUdfJ9fa2R56jjnN4qFQwBgpJKxtGynkAmSWf1K3XKt8dmpRysOmPYYOj2VsT48AuzSS1uz1hWnL2Bky9JdBHq3khqdgWayG2uod2c3e0pqnat3YzKiR9IcBau3ZXgMyq09PqrrRVDMM1zUsnocvz127Z3fNnZRebBePnAhIO1UJWId8S0fBZueFAmtYtsq9ZGdXacMKbTPRhGccby3ybe5sw3aEKG4UPBo0eH7P5HFWnJqZC3EW63SlDBAzonFf7NKtRUtlC6RVGnfhqfXpiV9m1evvSlTmHVSoVeKtyhzDWzgKKCGdwPW8K211Y5DqVv5uC9HtRNgyZtBsXwVKSzam4O1qf2J8MCSfNWMbgYUa5CQIFUXbsfWZWiIcHaoCqBV8CTKfRAp2DUhWlYZW9fpgKGGOWau9d2wE5FamSQRke3d8nCF6wRy3PE2yPT2slRhLLgEKC3IVS0MD7GulH9rDpGP8rWTWa8Cg9sE0ZQUvXSoRzv2KyylMJqStZLTKIW62dhysFRujvStSbz7IRKOuQDmN2PoyANJp9cGqhzYGQsoJuHOqbJVTvwe0MfSbhOqCZKmTYZEg2xmFlRjPGdsy1y6t23VbABfFRe4n1swofqqVTP5urfUEmQe4OvNoD8yNyNwbrJMj3HNrsn8XRNnSjZmh7flCwO87fIgxwmvT1SQgsWFn4spvF867esGRcrTbIFWEWu1SmVYyAM6iT3Y8HHoDkr",
        "recipient_priv_pem_path": "test-vectors/v1/fixtures/keys/bob-rsa4096-priv.pem",
        "trusted_senders": [
          {
            "key_hash": "1bf44bedd390cd114d5511c53286330f29c9fe70a4ab86118731860898ef88da",
            "public_key_pem_path": "test-vectors/v1/fixtures/keys/alice-rsa2048-pub.pem"
          }
        ]
      },
      "expected": {
        "outcome": "decryption-failed",
        "plaintext_present": false
      }
    }
  ]
}
